Symbol	Tickers	ID	ArrivalDate	Created	ArrivalTime	CurlTime	Headline	Author	Float	MktCap	Exchange	LastDailyClose	itiBaseline	tradeSizeBaseline	FinBERTCompletedAt	positive	negative	neutral	sentiment_score	label	Sentiment	ClerkArm	ClerkSentiment	nocoref_neutral_filter	nocoref_confidence_weighted	nocoref_net_score	nocoref_top_k	nocoref_positional	NoCorefCompletedAt
DBGI	"[""DBGI""]"	nBw38jx9sa	2026-06-18	15:45:00.100	15:45:00.223	15:45:00.512	DBGI Announces Expiration of 9.6 Million Outstanding Cash Warrants, Eliminating Dilution Overhang	Business Wire	22.92	16.96	NASDAQ	0.7322	5.9	709.3627	2026-06-18 15:45:00.530738	0.1948	0.1305	0.6746	0.0643	positive	BAD	accepted:1005	sentiment_bad_released	0.0146	0.0043	0.0257	0.0568	0.0274	2026-06-18 15:45:01.236414
MTEN	"[""MTEN""]"	nGNX2t9zZh	2026-06-18	16:05:00.188	16:05:00.584	16:05:02.742	Mingteng International Corporation Inc. Announces Closing of $2.96 Million Registered Direct Offering and Concurrent Private Placement	Globe Newswire	0.84	3.74	NASDAQ	2.61	12.2	288.1394	2026-06-18 16:05:02.772547	0.0699	0.0369	0.8932	0.033	neutral	BAD	accepted:1006	sentiment_bad_released	0.1031	0.0741	0.0512	0.2043	0.0703	2026-06-18 16:05:03.305719
MSGM	"[""MSGM""]"	nGNX2WwsX6	2026-06-18	16:10:00.125	16:10:00.696	16:10:03.532	Motorsport Games Names Peter Hansen-Chambers Chief Financial Officer, Effective July 1, 2026	Globe Newswire	1.62	19.01	NASDAQ	3.75	24428.6	439.8235	2026-06-18 16:10:03.559222	0.0581	0.0534	0.8885	0.0047	neutral	BAD	accepted:1008	sentiment_bad_released	0.4383	0.4912	0.2458	0.7908	0.2798	2026-06-18 16:10:04.142568
GROW	"[""GROW""]"	nGNX82GSLL	2026-06-18	16:25:25.101	16:25:25.286	16:25:25.544	U.S. Global Investors Declares Continued Monthly Dividend as Oil Drops Below the 50-Day Moving Average, a Positive Signal for Tactical Investors and Traders	Globe Newswire	9.66	36.1	NASDAQ	3.035	20900.0	1192.6364	2026-06-18 16:25:25.577979	0.6744	0.1832	0.1424	0.4913	positive	BAD	accepted:1009	sentiment_bad_released	0.4543	0.551	0.3313	0.8833	0.3903	2026-06-18 16:25:26.125825
AMIX	"[""AMIX""]"	nGNX73m7s7	2026-06-18	16:30:00.213	16:30:00.708	16:30:04.060	Autonomix Announces Reverse Stock Split	Globe Newswire	10.88	4.52	NASDAQ	0.389	4660.6	712.1154	2026-06-18 16:30:04.072986	0.0804	0.1169	0.8027	-0.0365	neutral	BAD	accepted:1010	sentiment_bad_released	0.1079	0.0514	0.0788	0.2996	0.0874	2026-06-18 16:30:04.574345
SCAG	"[""SCAG""]"	nGNX6zxXZj	2026-06-18	16:45:00.105	16:45:00.324	16:45:00.601	Scage Future Receives Nasdaq Notification Regarding Minimum Bid Price Deficiency	Globe Newswire	26.63	24.99	NASDAQ	0.3395	512.6	646.9217	2026-06-18 16:45:00.617191	0.0903	0.034	0.8757	0.0563	positive	BAD	accepted:1011	sentiment_bad_released	0.1925	0.2607	0.1462	0.6076	0.1081	2026-06-18 16:45:01.315013
EPSM	"[""EPSM""]"	nPn7jDMDna	2026-06-18	17:00:00.049	17:00:00.240	17:00:00.573	Epsium Enterprise Limited Launches New Investor Relations Website	PR Newswire	2.66	4.4	NASDAQ	1.56	1011.7	260.4103	2026-06-18 17:00:00.592583	0.0691	0.0292	0.9017	0.0399	neutral	BAD	accepted:1013	sentiment_bad_released	0.2422	0.2938	0.1234	0.5689	0.1882	2026-06-18 17:00:01.110136
MTR	"[""MTR""]"	nBw4Z74vsa	2026-06-18	17:08:00.090	17:08:00.205	17:08:00.469	Mesa Royalty Trust Announces There Will Be No Distribution for June 2026	Business Wire	1.6	6.34	NYSE	3.36	34200.0	122.25	2026-06-18 17:08:00.485840	0.0305	0.1384	0.8311	-0.1079	negative	BAD	accepted:1014	sentiment_bad_released	-0.1653	-0.2525	-0.0716	0.1585	-0.0873	2026-06-18 17:08:01.008943
MTEK	"[""MTEK""]"	nNFC53WMg8	2026-06-18	17:10:41.248	17:10:41.349	17:10:41.545	Metatek-Group Ltd. Announces Approval of All Resolutions at 2026 Annual Meeting	Newsfile Corp	5.63	12.13	TSX	1.22	1145.6	656.4144	2026-06-18 17:10:41.558695	0.1327	0.0158	0.8515	0.1169	positive	BAD	accepted:1015	sentiment_bad_released	0.2023	0.0986	0.0659	0.2023	0.0535	2026-06-18 17:10:41.932543
APM	"[""APM""]"	nNFC5TcxDR	2026-06-18	17:29:56.750	17:29:56.881	17:29:57.132	Statement in Response to Silver Elephant's News Release Dated June 17, 2026	Newsfile Corp	5.31	6.86	TSX	0.87	3596.4	554.7604	2026-06-18 17:29:57.149735	0.0734	0.0658	0.8608	0.0076	neutral	BAD	accepted:1016	sentiment_bad_released	0.1732	0.234	0.1373	0.6079	0.084	2026-06-18 17:29:57.485298
RAY	"[""RAY""]"	nGNX3wQzLv	2026-06-18	17:32:58.105	17:32:58.266	17:32:58.457	Stingray Announces $15.4 Million Share Buyback	Globe Newswire	1.86	8.44	TSX	3.34	19000.0	291.8654	2026-06-18 17:32:58.481611	0.0679	0.0324	0.8997	0.0354	neutral	BAD	accepted:1017	sentiment_bad_released	0.5143	0.514	0.2861	0.7605	0.2732	2026-06-18 17:32:59.118939
INEO	"[""INEO""]"	nACSDTV4pa	2026-06-18	18:56:19.932	18:56:20.089	18:56:20.352	INEO Announces Grant of Stock Options	ACCESSWIRE	1.97	10.03	NASDAQ	0.6098	2546.0	644.6879	2026-06-18 18:56:20.371055	0.1656	0.0784	0.756	0.0872	positive	BAD	accepted:1019	sentiment_bad_released	0.2842	0.3319	0.1261	0.6416	0.1668	2026-06-18 18:56:20.800516
CRMT	"[""CRMT""]"	nACSQjKNba	2026-06-18	19:05:00.770	19:05:00.867	19:05:01.102	ROSEN, A TRUSTED AND LEADING LAW FIRM, Encourages Americas Car-Mart, Inc. Investors to Inquire About Securities Class Action Investigation - CRMT	ACCESSWIRE	7.61	19.43	NASDAQ	2.21	323.9	412.0049	2026-06-18 19:05:01.127361	0.1913	0.0434	0.7653	0.1479	positive	BAD	accepted:1000	sentiment_bad_released	-0.1036	-0.2183	-0.0595	0.4795	-0.1204	2026-06-18 19:05:01.698914
IHT	"[""IHT""]"	nGNX9wMtHt	2026-06-18	21:59:00.108	21:59:00.229	21:59:00.583	INNSUITES FY 2027 Q1 RECORDS CONSOLIDATED NET INCOME PROFIT; REVERSE MERGER EXPLORATION CONTINUES	Globe Newswire	3.0	16.63	NYSE AMERICAN	1.39	17100.0	1064.4	2026-06-18 21:59:00.608617	0.6115	0.031	0.3575	0.5804	positive	BAD	accepted:1001	sentiment_bad_released	0.4881	0.5991	0.4881	0.8968	0.5655	2026-06-18 21:59:01.142714
