Symbol	Tickers	ID	Created	ArrivalDate	ArrivalTime	CurlTime	Headline	Author	Float	MktCap	Exchange	LastDailyClose	itiBaseline	tradeSizeBaseline	FinBERTCompletedAt	positive	negative	neutral	sentiment_score	label	Sentiment	ClerkArm	ClerkSentiment	nocoref_neutral_filter	nocoref_confidence_weighted	nocoref_net_score	nocoref_top_k	nocoref_positional	NoCorefCompletedAt
ATHR	"[""ATHR""]"	nGNX2tS7Cs	16:59:56.089	2026-06-16	16:59:56.196	16:59:56.554	INVESTOR ALERT: Pomerantz Law Firm Investigates Claims On Behalf of Investors of Aether Holdings, Inc. - ATHR	Globe Newswire	4.12	37.77	NASDAQ	3.11	34200.0	276.6	2026-06-16 16:59:56.576604	0.1031	0.1145	0.7825	-0.0114	neutral	BAD	accepted:1012	sentiment_bad_released	-0.0985	-0.1927	-0.0603	0.1621	-0.0362	2026-06-16 16:59:56.947057
NTIC	"[""NTIC""]"	nGNXbzmlVt	17:00:00.118	2026-06-16	17:00:00.472	17:00:00.875	Natur Tec India and Bayer to Develop Compostable Seedling Cups	Globe Newswire	7.83	76.41	NASDAQ	8.05	28500.0	383.25	2026-06-16 17:00:00.902329	0.3826	0.0105	0.607	0.3721	positive	OK	accepted:1008	sentiment_ack	0.5232	0.595	0.4283	0.7821	0.4537	2026-06-16 17:00:01.558759
TDTH	"[""TDTH""]"	nGNX4DCdDK	17:00:00.153	2026-06-16	17:00:00.604	17:00:02.250	Trident Announces Termination of Deposit Agreement, Concurrent Changes to Share Capital and Direct Listing of Ordinary Shares	Globe Newswire	3.0453	9.0	NASDAQ	2.52	2951.8	299.2841	2026-06-16 17:00:02.269897	0.044	0.1286	0.8274	-0.0846	negative	BAD	accepted:1016	sentiment_bad_released	0.1966	0.2315	0.1082	0.4356	0.0838	2026-06-16 17:00:02.840566
CNVS	"[""CNVS""]"	nPnbTsxXQa	17:04:19.533	2026-06-16	17:04:19.682	17:04:19.820	'Return to Silent Hill' from Cineverse Premieres on Hulu	PR Newswire	18.12	60.05	NASDAQ	2.82	23318.2	1070.9412	2026-06-16 17:04:19.837609	0.2434	0.0737	0.6829	0.1696	positive	OK	accepted:1010	sentiment_ack	0.1349	0.1768	0.1233	0.3365	0.0999	2026-06-16 17:04:20.340201
PHR	"[""PHR""]"	nACSN03P3a	17:12:00.687	2026-06-16	17:12:00.874	17:12:01.128	July 13, 2026 Deadline: Join Class Action Lawsuit Against Phreesia, Inc. (PHR) - Contact Levi & Korsinsky	ACCESSWIRE	49.77	560.02	NYSE	9.06	3221.0	20873.2676	2026-06-16 17:12:01.147690	0.169	0.1171	0.7139	0.052	positive	BAD	accepted:1006	sentiment_bad_released	-0.1388	-0.25	-0.0727	0.4762	-0.1268	2026-06-16 17:12:01.517452
AZTR	"[""AZTR""]"	nPn3qysTma	17:29:13.931	2026-06-16	17:29:14.089	17:29:14.266	Azitra, Inc. to Present at 2026 BIO International Convention	PR Newswire	16.19	3.43	NYSE AMERICAN	0.2117	1058.9	1247.1804	2026-06-16 17:29:14.294896	0.0904	0.0111	0.8985	0.0794	positive	BAD	accepted:1005	sentiment_bad_released	0.2047	0.1847	0.1537	0.3859	0.1633	2026-06-16 17:29:14.810061
TLSI	"[""TLSI""]"	nGNX4BpdXD	17:31:24.101	2026-06-16	17:31:24.172	17:31:24.290	INVESTOR ALERT: Pomerantz Law Firm Investigates Claims On Behalf of Investors of TriSalus Life Sciences Inc. - TLSI	Globe Newswire	38.14	231.54	NASDAQ	3.77	20900.0	6449.7059	2026-06-16 17:31:24.303708	0.0971	0.096	0.8068	0.0011	neutral	BAD	accepted:1015	sentiment_bad_released	-0.2836	-0.433	-0.1476	0.1596	-0.1603	2026-06-16 17:31:25.233290
YQ	"[""YQ""]"	nGNXbxqSQV	18:00:00.295	2026-06-16	18:00:00.893	18:00:01.268	17 Education & Technology Group Inc. Announces First Quarter 2026 Unaudited Financial Results	Globe Newswire	6.65	16.07	NASDAQ	2.35	10260.0	336.4615	2026-06-16 18:00:01.312825	0.1223	0.2168	0.6609	-0.0944	negative	BAD	accepted:1000	sentiment_bad_released	0.1512	0.1737	0.1407	0.8999	0.0593	2026-06-16 18:00:02.304685
PHR	"[""PHR""]"	nACSQDc3Ba	18:00:01.330	2026-06-16	18:00:01.554	18:00:01.858	PHR DEADLINE NOTICE: Phreesia, Inc. Investors Encouraged to Contact Kirby McInerney LLP By July 13, 2026	ACCESSWIRE	49.77	560.02	NYSE	9.06	3221.0	20873.2676	2026-06-16 18:00:01.954531	0.0713	0.0233	0.9053	0.048	neutral	BAD	accepted:1002	sentiment_bad_released	-0.0957	-0.1914	-0.0586	0.6863	-0.0743	2026-06-16 18:00:02.832949
MCRP	"[""MCRP""]"	nGNX7JwrmZ	18:27:00.102	2026-06-16	18:27:00.206	18:27:00.413	Micropolis Robotics Expands Physical AI Portfolio with Five-Year Autonomous Sweeper Deployment Agreement with Abu Dhabi Government	Globe Newswire	10.32	65.24	NYSE AMERICAN	1.87	11400.0	271.16	2026-06-16 18:27:00.429041	0.848	0.0078	0.1442	0.8402	positive	OK	accepted:1019	sentiment_ack	0.3674	0.4572	0.2674	0.7421	0.3756	2026-06-16 18:27:00.941172
INEO	"[""INEO""]"	nACSkhmqZa	18:35:01.053	2026-06-16	18:35:01.212	18:35:01.379	INEO Tech Corp. Announces Closing of Private Placement and Debt Settlement	ACCESSWIRE	1.97	10.19	NASDAQ	0.6301	1651.7	428.9926	2026-06-16 18:35:01.404271	0.0861	0.0994	0.8144	-0.0133	neutral	BAD	accepted:1017	sentiment_bad_released	0.2147	0.179	0.0822	0.2972	0.0752	2026-06-16 18:35:02.020175
ELWT	"[""ELWT""]"	nACS0KnVka	18:45:01.332	2026-06-16	18:45:01.447	18:45:01.659	ROSEN, GLOBAL INVESTOR COUNSEL, Encourages Elauwit Connection, Inc. Investors to Inquire About Securities Class Action Investigation - ELWT	ACCESSWIRE	2.16	41.04	NASDAQ	6.2	22800.0	229.5152	2026-06-16 18:45:01.682577	0.1338	0.0429	0.8233	0.0909	positive	BAD	accepted:1007	sentiment_bad_released	0.0447	-0.0112	0.0411	0.453	-0.0203	2026-06-16 18:45:02.096716
FJET	"[""FJET""]"	nPn6qFlfLa	19:30:00.045	2026-06-16	19:30:00.129	19:30:00.527	Robbins LLP Reminds FJET Stockholders of its Investigation into Starfighters Space, Inc.; Contact the Firm for Information	PR Newswire	32.87	306.69	NYSE AMERICAN	6.18	86.9	528.6556	2026-06-16 19:30:00.550747	0.1276	0.0353	0.8371	0.0923	positive	BAD	accepted:1003	sentiment_bad_released	-0.1508	-0.3022	-0.0822	0.1775	-0.1307	2026-06-16 19:30:00.865373
ATHR	"[""ATHR""]"	nPn77219na	19:30:00.843	2026-06-16	19:30:00.950	19:30:01.515	Robbins LLP Reminds ATHR Stockholders of its Investigation into Aether Holdings, Inc.; Contact the Firm for Information	PR Newswire	4.12	37.77	NASDAQ	3.11	34200.0	276.6	2026-06-16 19:30:01.538235	0.1086	0.0386	0.8527	0.07	positive	BAD	accepted:1004	sentiment_bad_released	-0.0019	-0.0294	0.0082	0.2474	-0.0085	2026-06-16 19:30:02.128077
WYHG	"[""WYHG""]"	nGNX1dLMMV	20:00:00.111	2026-06-16	20:00:00.277	20:00:00.719	Wing Yip Food Holdings Group Limited Regains Compliance with Nasdaq Minimum Closing Bid Price Rule	Globe Newswire	25.831	53.21	NASDAQ	4.23	2396.1	207.4906	2026-06-16 20:00:00.737368	0.793	0.0447	0.1623	0.7484	positive	OK	accepted:1013	sentiment_ack	0.0393	0.0133	0.0361	0.3906	0.0359	2026-06-16 20:00:01.170781
PHR	"[""PHR""]"	nACSVSsf9a	20:45:01.127	2026-06-16	20:45:01.229	20:45:01.505	PHREESIA DEADLINE: ROSEN, LEADING INVESTOR COUNSEL, Encourages Phreesia, Inc. Investors with Losses in Excess of $100K to Secure Counsel Before Important Deadline in Securities Class Action - PHR	ACCESSWIRE	49.77	560.02	NYSE	9.06	3221.0	20873.2676	2026-06-16 20:45:01.527530	0.2168	0.0652	0.718	0.1516	positive	OK	accepted:1009	sentiment_bad_released	0.2123	0.2633	0.1466	0.539	0.0964	2026-06-16 20:45:01.987133
SOPH	"[""SOPH"", ""90B""]"	nPn9btNJha	21:22:32.051	2026-06-16	21:22:32.217	21:22:32.460	SOPHiA GENETICS Announces Pricing of $50 Million Public Offering of Ordinary Shares	PR Newswire	48.14	349.74	NASDAQ	4.88	28500.0	3216.1111	2026-06-16 21:22:32.480013	0.161	0.028	0.8109	0.133	positive	BAD	accepted:1011	sentiment_bad_released	0.2847	0.2073	0.0901	0.3824	0.1045	2026-06-16 21:22:33.296099
PHR	"[""PHR""]"	nACST2XjKa	21:25:00.264	2026-06-16	21:25:00.399	21:25:00.525	Levi & Korsinsky Urges Phreesia, Inc. (PHR) Shareholders to Act Before Lead Plaintiff Deadline July 13, 2026	ACCESSWIRE	49.77	560.02	NYSE	9.06	3221.0	20873.2676	2026-06-16 21:25:00.540069	0.1461	0.0232	0.8308	0.1229	positive	BAD	accepted:1018	sentiment_bad_released	-0.1496	-0.2552	-0.0802	0.5342	-0.1286	2026-06-16 21:25:01.020686
CRMT	"[""CRMT""]"	nGNXb9QsPH	22:40:57.090	2026-06-16	22:40:57.194	22:40:57.469	CRMT Investor News: If You Have Suffered Losses in America’s Car-Mart, Inc. (NASDAQ: CRMT), You Are Encouraged to Contact The Rosen Law Firm About Your Rights	Globe Newswire	7.61	17.35	NASDAQ	2.09	106.3	385.5573	2026-06-16 22:40:57.497941	0.2677	0.0854	0.6468	0.1823	positive	OK	accepted:1012	sentiment_bad_released	-0.0459	-0.1512	-0.0187	0.4795	-0.0746	2026-06-16 22:40:57.852191
